"id","strengths","date_of_birth","eyes_color","height","greatest_enemies","image","heroes_id"
1,"agility, strength, speed",1918-07-04,blue,"188 cm","Adolf Hitler, Red Skull, Baron Zemo",captain-america.jpg,1
2,"ingenious scientist, business magnate, inventor",1970-05-25,brown,"185 cm","Mandarin, Obadiah Stane, Justin Hammer",iron-man.jpg,2
3,his hammer,0001-01-01,blue,"190 cm","Galactus, Mangog, Surtur",thor.jpg,3
4,power increase as his anger grows,1969-12-18,brown,"243 cm","The Leader, Abomination, General Thaddeus ""Thunderbolt""",hulk.jpg,4
5,"master in infiltration, espionage",1984-12-03,blue,"164 cm","Yelena Belova, Alexi Shostakov, Madame Hydra",black-widow.jpg,5
6,"fencer, acrobat and marksman",1971-06-18,brown,"173 cm","Crossfire, Swordsman, Baron Helmut Zemo",hawkeye.jpg,6
